[
  {
    "name": "jab",
    "duration": 0.3,
    "category": "attack",
    "keyframes": [
      { "time": 0, "pose": "guard", "easing": "power2.in" },
      { "time": 0.4, "pose": "punch_extend_left", "easing": "power2.out" },
      { "time": 1, "pose": "guard", "easing": "power2.inOut" }
    ]
  },
  {
    "name": "cross",
    "duration": 0.4,
    "category": "attack",
    "keyframes": [
      { "time": 0, "pose": "guard", "easing": "power2.in" },
      { "time": 0.5, "pose": "punch_extend_right", "easing": "power3.out" },
      { "time": 1, "pose": "guard", "easing": "power2.inOut" }
    ]
  },
  {
    "name": "block_high",
    "duration": 0.2,
    "category": "defense",
    "keyframes": [
      { "time": 0, "pose": "guard", "easing": "power3.out" },
      { "time": 0.4, "pose": "block_high", "easing": "power2.out" },
      { "time": 1, "pose": "guard", "easing": "power2.inOut" }
    ]
  },
  {
    "name": "block_low",
    "duration": 0.2,
    "category": "defense",
    "keyframes": [
      { "time": 0, "pose": "guard", "easing": "power3.out" },
      { "time": 0.4, "pose": "block_low", "easing": "power2.out" },
      { "time": 1, "pose": "guard", "easing": "power2.inOut" }
    ]
  },
  {
    "name": "stagger_back",
    "duration": 0.4,
    "category": "reaction",
    "keyframes": [
      { "time": 0, "pose": "guard", "easing": "power2.in" },
      { "time": 0.3, "pose": "stagger_back", "easing": "power2.out" },
      { "time": 1, "pose": "guard", "easing": "power1.inOut" }
    ]
  }
]
